{
  "schema_version": "alice.phase1_evaluation_report.v1",
  "generated_at": "2026-04-17T03:45:00Z",
  "git": {
    "branch": "example-branch",
    "commit": "example-commit",
    "dirty": false
  },
  "evaluation_scope": {
    "phase_label": "Alice Phase 1",
    "included_steps": [
      "step3_registry",
      "step4_subject_resolution",
      "step5_planning",
      "step6_retrieval_assembly",
      "step7_parcel_candidates",
      "step8_report_rendering",
      "step9_use_case_modules",
      "step10_recommendation",
      "pre_step11_stabilization_patch"
    ],
    "validator_scripts": [
      "scripts/validate_registry.py",
      "scripts/validate_subject_resolution.py",
      "scripts/validate_step5.py",
      "scripts/validate_step6.py",
      "scripts/validate_step7.py",
      "scripts/validate_step8.py",
      "scripts/validate_step9.py",
      "scripts/validate_step10.py",
      "scripts/validate_step11.py (internal stabilization and report aggregation)"
    ],
    "notes": [
      "The unified runner executes the committed Alice validation chain rather than rebuilding separate check logic.",
      "Step 6 through Step 10 remain mostly deterministic and fixture-backed so the evaluation suite is stable enough for regression use.",
      "Step 11 adds explicit truthfulness summaries and packaging docs, but it does not expand the product surface."
    ]
  },
  "scenario_counts": {
    "registry": {
      "case_count": 3235,
      "case_labels": [
        "nationwide_county_index",
        "curated_overrides",
        "source_descriptors"
      ],
      "measurements": {
        "county_count": 3235,
        "curated_override_count": 2,
        "source_count": 20,
        "machine_endpoint_count": 2,
        "landing_page_count": 14,
        "viewer_count": 2,
        "mixed_count": 2
      },
      "notes": [
        "Counts the nationwide county backbone plus the curated override and source descriptor layers."
      ]
    },
    "subject_resolution": {
      "case_count": 12,
      "case_labels": [
        "address",
        "apn",
        "apn_unresolved",
        "batch_compare",
        "coordinates",
        "follow_up",
        "intent",
        "listing_url",
        "listing_url_competing_kern",
        "listing_url_fallback",
        "listing_url_inferred_curated",
        "listing_url_wind_hudspeth"
      ],
      "measurements": {
        "request_example_count": 12,
        "subject_resolution_example_count": 12,
        "session_state_example_count": 1
      },
      "notes": [
        "Tracks normalized requests, subject-resolution examples, and follow-up session-state examples."
      ]
    },
    "planning": {
      "case_count": 7,
      "case_labels": [
        "listing_url_inferred_curated",
        "listing_url_fallback",
        "apn_unresolved",
        "address",
        "coordinates",
        "follow_up",
        "batch_compare"
      ],
      "measurements": {
        "scenario_count": 7
      },
      "notes": [
        "Step 5 planning scenarios cover curated, fallback, unresolved, coordinates, follow-up, and batch-compare paths."
      ]
    },
    "retrieval_assembly": {
      "case_count": 4,
      "case_labels": [
        "listing_url_inferred_curated",
        "listing_url_fallback",
        "apn_unresolved",
        "follow_up_resolved"
      ],
      "measurements": {
        "scenario_count": 4
      },
      "notes": [
        "Step 6 scenario workspaces validate retrieval, raw evidence storage, fetch logging, and universal research assembly."
      ]
    },
    "parcel_candidates": {
      "case_count": 5,
      "case_labels": [
        "strong_curated_hudspeth",
        "wind_hudspeth",
        "fallback_weak_autauga",
        "competing_kern",
        "follow_up_strengthened"
      ],
      "measurements": {
        "scenario_count": 5
      },
      "notes": [
        "Step 7 scenario workspaces validate strong, weak, competing, follow-up, and wind parcel-candidate paths."
      ]
    },
    "report_rendering": {
      "case_count": 5,
      "case_labels": [
        "strong_curated_hudspeth",
        "wind_hudspeth",
        "fallback_weak_autauga",
        "competing_kern",
        "follow_up_strengthened"
      ],
      "measurements": {
        "scenario_count": 5
      },
      "notes": [
        "Step 8 scenario workspaces validate markdown, Slack, and email rendering across strong, weak, competing, follow-up, and wind cases."
      ]
    },
    "use_case_modules": {
      "case_count": 5,
      "case_labels": [
        "energy_strong_hudspeth",
        "wind_hudspeth",
        "development_uncertain_and_insufficient_autauga",
        "competing_thesis_kern",
        "agriculture_follow_up_hudspeth"
      ],
      "measurements": {
        "scenario_count": 5
      },
      "notes": [
        "Step 9 scenario workspaces validate solar, wind, agriculture, development, industrial, and rural-hold screening with economics guardrails."
      ]
    },
    "recommendation": {
      "case_count": 4,
      "case_labels": [
        "user_supplied_ranking",
        "open_discovery_rural_hold",
        "conflicted_shortlist",
        "weak_candidate_universe"
      ],
      "measurements": {
        "scenario_count": 4
      },
      "notes": [
        "Step 10 scenario workspaces validate user-supplied ranking, open discovery, conflicted shortlist, and thin candidate-universe paths."
      ]
    },
    "stabilization": {
      "case_count": 4,
      "case_labels": [
        "access_mode_semantics",
        "confirmation_basis_semantics",
        "coverage_tier_rubric",
        "wind_module_exercised"
      ],
      "measurements": {
        "stabilization_check_count": 4
      },
      "notes": [
        "Step 11 retains explicit access_mode, confirmation_basis, coverage-tier rubric, and wind exercise checks from the stabilization patch."
      ]
    }
  },
  "benchmark_buckets": [
    {
      "bucket_id": "registry_coverage",
      "label": "Registry / Coverage",
      "validator": "scripts/validate_registry.py",
      "check_types": [
        "contract",
        "stabilization",
        "regression"
      ],
      "case_count": 3,
      "case_labels": [
        "nationwide_county_index",
        "curated_overrides",
        "source_descriptors"
      ],
      "status": "passed",
      "duration_ms": 0,
      "summary": "Alice registry validation passed: 3235 counties, 2 county overrides, 20 sources.",
      "stdout_summary": "Alice registry validation passed: 3235 counties, 2 county overrides, 20 sources.",
      "failure_message": null,
      "notes": [
        "Validates the nationwide county backbone, curated override integrity, fallback generation, source descriptor integrity, access_mode coverage, and coverage-tier rubric alignment."
      ]
    },
    {
      "bucket_id": "subject_resolution",
      "label": "Subject Resolution",
      "validator": "scripts/validate_subject_resolution.py",
      "check_types": [
        "contract",
        "heuristic",
        "regression"
      ],
      "case_count": 12,
      "case_labels": [
        "address",
        "apn",
        "apn_unresolved",
        "batch_compare",
        "coordinates",
        "follow_up",
        "intent",
        "listing_url",
        "listing_url_competing_kern",
        "listing_url_fallback",
        "listing_url_inferred_curated",
        "listing_url_wind_hudspeth"
      ],
      "status": "passed",
      "duration_ms": 0,
      "summary": "Alice subject resolution validation passed: 12 request examples, 12 subject resolution examples.",
      "stdout_summary": "Alice subject resolution validation passed: 12 request examples, 12 subject resolution examples.",
      "failure_message": null,
      "notes": [
        "Validates request examples, subject-resolution examples, session-state examples, listing URL normalization, APN normalization, batch mode, and follow-up state attachment."
      ]
    },
    {
      "bucket_id": "planning_source_plan",
      "label": "Planning / Source Plan",
      "validator": "scripts/validate_step5.py",
      "check_types": [
        "contract",
        "heuristic",
        "integration",
        "regression"
      ],
      "case_count": 7,
      "case_labels": [
        "listing_url_inferred_curated",
        "listing_url_fallback",
        "apn_unresolved",
        "address",
        "coordinates",
        "follow_up",
        "batch_compare"
      ],
      "status": "passed",
      "duration_ms": 0,
      "summary": "Alice Step 5 validation passed: 7 jurisdiction examples, 7 coverage examples, 7 source plan examples.",
      "stdout_summary": "Alice Step 5 validation passed: 7 jurisdiction examples, 7 coverage examples, 7 source plan examples.",
      "failure_message": null,
      "notes": [
        "Validates jurisdiction context, coverage assessment, and source planning before live retrieval."
      ]
    },
    {
      "bucket_id": "retrieval_assembly",
      "label": "Retrieval / Extraction / Assembly",
      "validator": "scripts/validate_step6.py",
      "check_types": [
        "contract",
        "integration",
        "regression"
      ],
      "case_count": 4,
      "case_labels": [
        "listing_url_inferred_curated",
        "listing_url_fallback",
        "apn_unresolved",
        "follow_up_resolved"
      ],
      "status": "passed",
      "duration_ms": 0,
      "summary": "Alice Step 6 validation passed: 4 scenario workspaces, schema-valid fetch logs, extracted evidence, and parcel memos.",
      "stdout_summary": "Alice Step 6 validation passed: 4 scenario workspaces, schema-valid fetch logs, extracted evidence, and parcel memos.",
      "failure_message": null,
      "notes": [
        "Validates deterministic fixture-backed retrieval, raw evidence capture, extraction, and universal research assembly."
      ]
    },
    {
      "bucket_id": "parcel_candidates",
      "label": "Parcel-Candidate Strengthening",